[
  {
    "id": "fiatella_noun",
    "lemma": "fiatella",
    "pos": "noun",
    "ipa": "/fjaˈtɛllə/",
    "gender": "feminine",
    "number": "singular",
    "metaphony": false,
    "translations": {
      "it": ["alito pesante", "puzza di fiato"],
      "en": ["bad breath", "halitosis"]
    },
    "examples": [
      {
        "nap": "Tene 'na fiatella ca fa murì.",
        "it": "Ha un alito pesante che fa morire.",
        "en": "They have bad breath that could kill you."
      }
    ],
    "meta": {
      "status": "verified",
      "source": "curated_lexicon",
      "confidence": "high"
    }
  }
]
